ガーター付きバスチェとトングセット	Bustier with garters and thong set
マッチングガーターベルト付きオフショルダーシアーナイティ	Off-the-shoulder sheer nightie with matching garter belt
刺繍入りテディとシルクのブリーフ	Embroidered teddy and silk briefs
フィッシュネットボディストッキング	Fishnet bodystocking
フリル付きベビードールとマッチングショーツ	Frilly babydoll and matching shorts
ピーカブーカップのホルターネックレーステディ	Halter neck lace teddy with peek-a-boo cups
ディープVバックのハイレグレースボディスーツ	High-leg lace bodysuit with deep V-back
メッシュパネルのナイティとヒップスターブリーフ	Mesh panel nightie and hipster briefs
サテンのコルセットとレースアップバックのパンティ	Satin corset and lace-up (back panties)
ベルベットのキャミソールとレースのボーイショーツ	Velvet camisole and lace boyshorts
カットアウトディテールのベルベットプランジボディスーツ	Velvet plunge bodysuit with cutout details
